{
  "schemaVersion": 1,
  "id": "swiftui-calculator",
  "title": "SwiftUI Calculator Implementation Plan",
  "project": "swiftui-calculator",
  "status": "planned",
  "summary": [
    "Build a polished calculator app in Swift using SwiftUI, with a small calculation engine separated from the view layer so arithmetic behavior can be tested without UI automation.",
    "The plan starts with project structure and core expression behavior, then builds the visual calculator surface, input handling, memory features, history, accessibility, persistence, and release readiness.",
    "The app should feel native on iPhone and iPad, support portrait and landscape layouts, and preserve predictable calculator behavior for common numeric edge cases."
  ],
  "metadata": {
    "platforms": ["iOS"],
    "language": "Swift",
    "uiFramework": "SwiftUI",
    "minimumTarget": "iOS 17",
    "architecture": "SwiftUI views backed by a tested calculator engine"
  },
  "sections": [
    {
      "id": "design-rules",
      "title": "Design Rules",
      "kind": "rules",
      "items": [
        {
          "title": "Engine first",
          "text": "Arithmetic, formatting, memory, and history behavior must live outside SwiftUI views."
        },
        {
          "title": "Native interaction",
          "text": "Buttons, gestures, haptics, dynamic type, and accessibility labels should follow iOS expectations."
        },
        {
          "title": "Predictable numbers",
          "text": "Decimal input, rounding, overflow, divide-by-zero, and repeated equals behavior must be explicitly specified and tested."
        }
      ]
    },
    {
      "id": "core-architecture",
      "title": "Core Architecture",
      "kind": "architecture",
      "rows": [
        {
          "component": "CalculatorEngine",
          "responsibility": "Owns numeric state, operators, expression evaluation, memory state, and error handling."
        },
        {
          "component": "CalculatorViewModel",
          "responsibility": "Adapts engine state to SwiftUI display strings, button enabled states, haptics, and persistence triggers."
        },
        {
          "component": "CalculatorView",
          "responsibility": "Renders display, keypad, history sheet, settings, and accessibility metadata."
        }
      ]
    }
  ],
  "epics": [
    {
      "id": "E1",
      "title": "Project Foundation",
      "summary": "Create the SwiftUI app skeleton, module boundaries, and basic test setup.",
      "tags": ["foundation"],
      "stories": [
        {
          "id": "E1.S1",
          "title": "Create SwiftUI App Target",
          "details": [
            "Create a SwiftUI app target with a single main calculator scene.",
            "Set the deployment target and app metadata.",
            "Add separate folders or groups for engine, view model, views, persistence, and tests."
          ],
          "acceptanceCriteria": [
            "The app launches to an empty calculator shell without runtime warnings.",
            "The project has a clear separation between UI and calculation logic.",
            "The test target can run at least one placeholder unit test."
          ],
          "unitTests": [
            "Run the default unit test target successfully."
          ],
          "filesLikelyTouched": [
            "CalculatorApp.swift",
            "CalculatorView.swift"
          ]
        },
        {
          "id": "E1.S2",
          "title": "Define Core Domain Types",
          "details": [
            "Define types for calculator buttons, operations, input events, display state, and calculation errors.",
            "Keep the domain types independent from SwiftUI."
          ],
          "acceptanceCriteria": [
            "Domain types compile without importing SwiftUI.",
            "Every visible keypad button maps to a typed input event.",
            "Errors have stable typed cases instead of display strings only."
          ],
          "unitTests": [
            "Test that all button definitions map to valid input events."
          ]
        }
      ]
    },
    {
      "id": "E2",
      "title": "Calculator Engine",
      "summary": "Implement the arithmetic state machine and the core behavior expected from a basic calculator.",
      "tags": ["engine", "test-heavy"],
      "stories": [
        {
          "id": "E2.S1",
          "title": "Implement Digit and Decimal Input",
          "details": [
            "Support appending digits to the current operand.",
            "Support a single decimal separator per operand.",
            "Support leading zero and replacement behavior after operations."
          ],
          "acceptanceCriteria": [
            "Entering digits updates the current display predictably.",
            "Entering multiple decimal separators does not corrupt the operand.",
            "Starting a new operand after an operator replaces the display instead of appending."
          ],
          "unitTests": [
            "Test multi-digit input.",
            "Test decimal input rejects a second decimal separator.",
            "Test new operand entry after selecting an operator."
          ]
        },
        {
          "id": "E2.S2",
          "title": "Implement Binary Operators",
          "details": [
            "Support addition, subtraction, multiplication, and division.",
            "Store pending operator state until equals or another operator is pressed.",
            "Handle operator replacement when the user taps operators repeatedly."
          ],
          "acceptanceCriteria": [
            "Basic binary operations produce correct results.",
            "Repeated operator taps replace the pending operator.",
            "Pressing an operator after entering a second operand evaluates the prior operation."
          ],
          "unitTests": [
            "Test addition, subtraction, multiplication, and division.",
            "Test chained operator behavior.",
            "Test operator replacement behavior."
          ],
          "dependencies": ["E2.S1"]
        },
        {
          "id": "E2.S3",
          "title": "Implement Unary Operators",
          "details": [
            "Support sign toggle, percent, and clear-entry behavior.",
            "Apply unary operations to the currently editable operand."
          ],
          "acceptanceCriteria": [
            "Sign toggle flips positive and negative values.",
            "Percent behavior is documented and consistent.",
            "Clear-entry resets the current operand without losing unrelated persistent state."
          ],
          "unitTests": [
            "Test sign toggle for positive, negative, and zero values.",
            "Test percent behavior for standalone and pending-operation cases.",
            "Test clear-entry behavior."
          ],
          "dependencies": ["E2.S1"]
        },
        {
          "id": "E2.S4",
          "title": "Implement Equals and Repeated Equals",
          "details": [
            "Evaluate the pending operation when equals is pressed.",
            "Remember the last operation so repeated equals repeats the last calculation."
          ],
          "acceptanceCriteria": [
            "Equals computes the displayed result.",
            "Repeated equals applies the last operand and operator again.",
            "Equals with no pending operation is harmless."
          ],
          "unitTests": [
            "Test equals after a binary operation.",
            "Test repeated equals for addition and multiplication.",
            "Test equals with no pending operation."
          ],
          "dependencies": ["E2.S2"]
        },
        {
          "id": "E2.S5",
          "title": "Handle Numeric Errors",
          "details": [
            "Represent divide-by-zero, overflow, and invalid decimal states as typed errors.",
            "Reset error state only when the user starts a clear or new valid calculation."
          ],
          "acceptanceCriteria": [
            "Divide-by-zero shows an error state instead of crashing.",
            "Overflow is detected before displaying misleading results.",
            "After an error, clear returns the engine to a usable initial state."
          ],
          "unitTests": [
            "Test divide-by-zero error state.",
            "Test clear after error.",
            "Test large-number overflow handling."
          ],
          "dependencies": ["E2.S2"]
        }
      ]
    },
    {
      "id": "E3",
      "title": "Display Formatting",
      "summary": "Convert engine state into concise, readable display strings.",
      "stories": [
        {
          "id": "E3.S1",
          "title": "Format Standard Results",
          "details": [
            "Create a formatter for integers, decimals, negative values, and trailing zeros.",
            "Keep formatter behavior deterministic across locales unless locale-specific display is explicitly enabled."
          ],
          "acceptanceCriteria": [
            "Whole-number results do not show unnecessary decimal suffixes.",
            "Decimal results are rounded to fit the display.",
            "Negative values preserve the sign and remain readable."
          ],
          "unitTests": [
            "Test integer formatting.",
            "Test decimal rounding.",
            "Test negative number formatting."
          ],
          "dependencies": ["E2.S1"]
        },
        {
          "id": "E3.S2",
          "title": "Format Scientific Notation",
          "details": [
            "Use scientific notation when values exceed display capacity.",
            "Ensure very small non-zero values remain distinguishable from zero."
          ],
          "acceptanceCriteria": [
            "Large values switch to scientific notation.",
            "Small values do not silently round to zero when precision remains meaningful.",
            "Scientific notation fits the display area."